{
  "schemaVersion": 1,
  "entityType": "album",
  "albumId": "album_so-we-sleep",
  "releaseId": "release_so-we-sleep_2026",
  "slug": "so-we-sleep",
  "title": "So We Sleep",
  "artistName": "Tsonu",
  "releaseType": "album",
  "releaseDate": "2026-01-01",
  "status": "published",
  "visibility": "public",
  "publishedAt": "2026-05-23T00:00:00Z",
  "description": "Debut album by Tsonu.",
  "artwork": {
    "assetId": "asset_so-we-sleep_cover",
    "altText": "So We Sleep cover art",
    "sources": [
      {
        "path": "artwork/so-we-sleep/cover-1024.jpg",
        "width": 1024,
        "height": 1024,
        "mimeType": "image/jpeg"
      }
    ]
  },
  "credits": [
    {
      "role": "Artist",
      "names": [{ "name": "Tsonu" }]
    }
  ],
  "tracks": [
    {
      "trackId": "track_so-we-sleep_01",
      "discNumber": 1,
      "trackNumber": 1,
      "slug": "opening-dream",
      "title": "Opening Dream",
      "durationSeconds": 180,
      "explicit": false,
      "playback": {
        "hls": {
          "assetId": "asset_so-we-sleep_01_hls",
          "path": "albums/so-we-sleep/tracks/opening-dream/job_so-we-sleep_01_encode_20260523/hls/master.m3u8",
          "mimeType": "application/vnd.apple.mpegurl",
          "codecs": ["mp4a.40.2"]
        },
        "formats": [
          {
            "assetId": "asset_so-we-sleep_01_aac_192",
            "kind": "hls-rendition",
            "quality": "aac-192",
            "path": "albums/so-we-sleep/tracks/opening-dream/job_so-we-sleep_01_encode_20260523/hls/192k/index.m3u8",
            "mimeType": "application/vnd.apple.mpegurl",
            "bitrateKbps": 192,
            "sampleRateHz": 48000,
            "channels": 2
          },
          {
            "assetId": "asset_so-we-sleep_01_aac_320",
            "kind": "hls-rendition",
            "quality": "aac-320",
            "path": "albums/so-we-sleep/tracks/opening-dream/job_so-we-sleep_01_encode_20260523/hls/320k/index.m3u8",
            "mimeType": "application/vnd.apple.mpegurl",
            "bitrateKbps": 320,
            "sampleRateHz": 48000,
            "channels": 2
          },
          {
            "assetId": "asset_so-we-sleep_01_flac",
            "kind": "download",
            "quality": "flac-lossless",
            "path": "albums/so-we-sleep/tracks/opening-dream/job_so-we-sleep_01_encode_20260523/lossless.flac",
            "mimeType": "audio/flac",
            "sampleRateHz": 48000,
            "bitDepth": 24,
            "channels": 2
          }
        ]
      }
    }
  ]
}
